product_name,Date,reviews
OnePlus Bullets Wireless Z2 Bluetooth,28-12-2024,"The earbuds frequently disconnect, and the sound is very muffled."
OnePlus Bullets Wireless Z2 Bluetooth,29-12-2024,"The sound is average, but the connection issues seem to have improved slightly."
OnePlus Bullets Wireless Z2 Bluetooth,30-12-2024,Great sound quality and reliable connection. They are now worth the price.
OnePlus Bullets Wireless Z2 Bluetooth,31-12-2024,"Battery life is disappointing, but the fit is comfortable."
OnePlus Bullets Wireless Z2 Bluetooth,01-01-2025,"After firmware updates, connectivity is stable. Satisfied!"
OnePlus Bullets Wireless Z2 Bluetooth,02-01-2025,"Bass is deep and rich, but call quality is subpar."
OnePlus Bullets Wireless Z2 Bluetooth,03-01-2025,Excellent product! Noise cancellation is impressive for this price.
TRIGGR Trinity 1,29-12-2024,"The step counter is highly inaccurate, and the app keeps crashing."
TRIGGR Trinity 1,30-12-2024,"The tracking has improved after updates, but the app is still buggy."
TRIGGR Trinity 1,31-12-2024,"Accurate tracking, smooth syncing, and a user-friendly app. Very satisfied!"
TRIGGR Trinity 1,01-01-2025,"Battery life is poor, but heart rate monitoring is accurate."
TRIGGR Trinity 1,02-01-2025,Strap feels flimsy. Not sure if it will last long.
TRIGGR Trinity 1,03-01-2025,Very lightweight and comfortable to wear all day.
TRIGGR Trinity 1,04-01-2025,Great value for money! Tracks steps and workouts accurately.
Aroma NB128 Happy 24 Hours Playting Time Deep Bass Made In India,31-12-2024,"The battery life is poor, and the touchscreen is unresponsive."
Aroma NB128 Happy 24 Hours Playting Time Deep Bass Made In India,01-01-2025,"The touchscreen works better after the update, but the battery still drains quickly."
Aroma NB128 Happy 24 Hours Playting Time Deep Bass Made In India,02-01-2025,The updates fixed all the issues. Excellent battery life and smooth operation now!
Aroma NB128 Happy 24 Hours Playting Time Deep Bass Made In India,03-01-2025,GPS tracking is not very accurate.
Aroma NB128 Happy 24 Hours Playting Time Deep Bass Made In India,04-01-2025,"Stylish design and smooth performance, but charging takes too long."
Aroma NB128 Happy 24 Hours Playting Time Deep Bass Made In India,05-01-2025,"Great fitness features, but notifications are sometimes delayed."
Aroma NB128 Happy 24 Hours Playting Time Deep Bass Made In India,06-01-2025,Best smartwatch in this price range! Would recommend.
